From	To	Reaction Type	Controller	Control Type	Cell Type	PMIDs	Genes	Drugs	Diseases	Summary
voriconazole	4-hydroxyvoriconazole	Biochemical Reaction	CYP3A4	Gene	hepatocyte	18362161, 17433262, 12756205		voriconazole		Biochemical reaction from voriconazole to 4-hydroxyvoriconazole. This interaction is catalyzed by CYP3A4.
voriconazole	voriconazole n-oxide	Biochemical Reaction	CYP2C19, CYP2C9, CYP3A4, FMO1, FMO3, FMO5	Gene	hepatocyte	18362161, 17433262, 16802848, 12695341		voriconazole		Biochemical reaction from voriconazole to voriconazole n-oxide. This interaction can be catalyzed by FMO3, FMO1, CYP3A4, FMO5, CYP2C9 or CYP2C19.
voriconazole	hydroxyvoriconazole	Biochemical Reaction	CYP2C19	Gene	hepatocyte	23766489, 20002085, 12756205		voriconazole		Biochemical reaction from voriconazole to hydroxyvoriconazole. This interaction is catalyzed by CYP2C19.
dihydroxyvoriconazole	dihydroxyvoriconazole o-glucuronide	Biochemical Reaction	UGT1A4	Gene	hepatocyte	23766489, 20002085, 12756205				Biochemical reaction from dihydroxyvoriconazole to dihydroxyvoriconazole o-glucuronide. This interaction is catalyzed by UGT1A4.
hydroxyvoriconazole	hydroxyvoriconazole o-glucuronide	Biochemical Reaction	UGT1A4	Gene	hepatocyte	23766489, 20304965, 20002085, 12756205				Biochemical reaction from hydroxyvoriconazole to hydroxyvoriconazole o-glucuronide. This interaction is catalyzed by UGT1A4.
hydroxyvoriconazole	dihydroxyvoriconazole	Biochemical Reaction	CYP2C19	Gene	hepatocyte	23766489, 20002085, 12756205				Biochemical reaction from hydroxyvoriconazole to dihydroxyvoriconazole. This interaction is catalyzed by CYP2C19.
4-hydroxyvoriconazole	4-hydroxyvoriconazole 4-o-glucuronide	Biochemical Reaction	UGT1A4	Gene	hepatocyte	20304965, 20002085, 12756205				Biochemical reaction from 4-hydroxyvoriconazole to 4-hydroxyvoriconazole 4-o-glucuronide. This interaction is catalyzed by UGT1A4.
